{
  "schema_version": "servicenow-adapter-request-v2",
  "request_id": "snreq-bbbbbbbbbbbbbbbbbbbbbbbbbbbbbbbb",
  "operation": "create_draft",
  "dry_run": true,
  "write_enabled": false,
  "transport_profile": "evidence_gateway_v1",
  "instance": {
    "alias": "enterprise-sandbox",
    "origin": "https://dev00000.service-now.com"
  },
  "creation": {
    "model_sys_id": "11111111111111111111111111111111",
    "external_authorization_id": "CAB-POLICY-CHANGE-DRAFT-01"
  },
  "assessment": {
    "assessment_id": "urn:preflightops:assessment:sha256:aaaaaaaaaaaaaaaaaaaaaaaaaaaaaaaaaaaaaaaaaaaaaaaaaaaaaaaaaaaaaaaa",
    "report_id": "urn:preflightops:assessment-report:sha256:bbbbbbbbbbbbbbbbbbbbbbbbbbbbbbbbbbbbbbbbbbbbbbbbbbbbbbbbbbbbbbbb",
    "report_sha256": "bbbbbbbbbbbbbbbbbbbbbbbbbbbbbbbbbbbbbbbbbbbbbbbbbbbbbbbbbbbbbbbb",
    "verdict": "PASS",
    "risk_level": "LOW",
    "confidence_level": "HIGH",
    "policy_name": "production",
    "policy_version": "3.0.0",
    "commit": "cccccccccccccccccccccccccccccccccccccccc",
    "assessed_at": "2026-09-03T16:00:00Z"
  },
  "delivery": {
    "mapping_profile_id": "enterprise-evidence-default",
    "mapping_sha256": "dddddddddddddddddddddddddddddddddddddddddddddddddddddddddddddddd",
    "idempotency_key": "snv2-1212121212121212121212121212121212121212121212121212121212121212",
    "payload_sha256": "3434343434343434343434343434343434343434343434343434343434343434",
    "evidence_mode": "https_link",
    "evidence_url": "https://artifacts.example.test/preflightops/reports/example"
  },
  "preconditions": {
    "capability_attestation_sha256": "9999999999999999999999999999999999999999999999999999999999999999"
  }
}
